{"$id":"urn:aevum:schema:ws.operator_action.v1","$schema":"https://json-schema.org/draft/2020-12/schema","additionalProperties":false,"properties":{"action":{"enum":["finalize","recover","export","import","upgrade.apply","keyring.update"],"type":"string"},"actor":{"additionalProperties":false,"properties":{"actor_type":{"enum":["local_user","remote_user","service_account"],"type":"string"},"session":{"additionalProperties":false,"properties":{"authn":{"enum":["password","sshkey","sso","unknown"],"type":"string"},"remote_addr":{"maxLength":128,"type":"string"},"tty":{"maxLength":64,"type":"string"}},"type":"object"},"uid":{"minimum":0,"type":"integer"},"username":{"pattern":"^[A-Za-z0-9._-]{1,64}$","type":"string"}},"required":["actor_type"],"type":"object"},"inputs":{"additionalProperties":false,"properties":{"anchor":{"additionalProperties":false,"properties":{"kind":{"enum":["none","tpm"],"type":"string"},"pcr_bank":{"enum":["sha256","sha384"],"type":"string"},"pcrs":{"items":{"maximum":23,"minimum":0,"type":"integer"},"maxItems":24,"minItems":0,"type":"array"}},"type":"object"},"chain_id":{"pattern":"^chain:[a-z0-9][a-z0-9._-]{2,63}$","type":"string"},"in_path":{"maxLength":512,"type":"string"},"keyring_hash":{"pattern":"^sha256:[0-9a-f]{64}$","type":"string"},"ledger_root":{"maxLength":256,"type":"string"},"out_path":{"maxLength":512,"type":"string"},"range":{"additionalProperties":false,"properties":{"end_height_inclusive":{"minimum":0,"type":"integer"},"start_height":{"minimum":0,"type":"integer"}},"required":["start_height","end_height_inclusive"],"type":"object"},"release_manifest_hash":{"pattern":"^sha256:[0-9a-f]{64}$","type":"string"},"stream":{"enum":["computer","user","bridge"],"type":"string"}},"type":"object"},"invocation":{"additionalProperties":false,"properties":{"argv":{"items":{"maxLength":256,"type":"string"},"minItems":1,"type":"array"},"build":{"additionalProperties":false,"properties":{"build_ns":{"minimum":0,"type":"integer"},"git_rev":{"pattern":"^[0-9a-f]{7,40}$","type":"string"}},"type":"object"},"cmd":{"enum":["aevum"],"type":"string"},"version":{"additionalProperties":false,"properties":{"name":{"pattern":"^[A-Za-z0-9._-]{2,64}$","type":"string"},"semver":{"pattern":"^v[0-9]+\\.[0-9]+\\.[0-9]+$","type":"string"}},"required":["name","semver"],"type":"object"}},"required":["cmd","argv"],"type":"object"},"kind":{"const":"ws.operator_action.v1"},"outputs":{"additionalProperties":false,"properties":{"export_bundle_hash":{"pattern":"^sha256:[0-9a-f]{64}$","type":"string"},"finalize_path":{"maxLength":512,"type":"string"},"finalize_range_root":{"pattern":"^sha256:[0-9a-f]{64}$","type":"string"},"head_after":{"additionalProperties":false,"properties":{"block_hash":{"pattern":"^sha256:[0-9a-f]{64}$","type":"string"},"height":{"minimum":-1,"type":"integer"}},"type":"object"},"head_before":{"additionalProperties":false,"properties":{"block_hash":{"pattern":"^sha256:[0-9a-f]{64}$","type":"string"},"height":{"minimum":-1,"type":"integer"}},"type":"object"},"imported_bundle_hash":{"pattern":"^sha256:[0-9a-f]{64}$","type":"string"},"quarantined":{"minimum":0,"type":"integer"},"tmp_deleted":{"minimum":0,"type":"integer"}},"type":"object"},"result":{"additionalProperties":false,"properties":{"detail":{"maxLength":1024,"type":"string"},"error_code":{"pattern":"^[A-Z0-9_]{2,64}$","type":"string"},"exit_code":{"maximum":255,"minimum":0,"type":"integer"},"ok":{"type":"boolean"}},"required":["ok","exit_code"],"type":"object"},"v":{"const":1}},"required":["kind","v","action","actor","invocation","inputs","outputs","result"],"title":"Operator Action Receipt v1","type":"object"}
