{"action":"export","actor":{"actor_type":"local_user","uid":1000,"username":"torasu"},"inputs":{"chain_id":"chain:timechain.main","ledger_root":"/var/lib/aevum/ledger","out_path":"sha256:deadbeef","range":{"end_height_inclusive":0,"start_height":0},"stream":"computer"},"invocation":{"argv":["aevum","export","--stream","computer"],"cmd":"aevum","version":{"name":"aevum","semver":"v0.0.0"}},"kind":"ws.operator_action.v1","outputs":{"export_bundle_hash":"sha256:1111111111111111111111111111111111111111111111111111111111111111","head_after":{"block_hash":"sha256:2222222222222222222222222222222222222222222222222222222222222222","height":0},"head_before":{"block_hash":"sha256:0000000000000000000000000000000000000000000000000000000000000000","height":-1}},"result":{"exit_code":0,"ok":true},"v":1}
